{
  "schema_version": "1.0.0",
  "record_type": "parallel_reconciliation",
  "id": "parallel-reconciliation-v1",
  "generated_at": "2026-06-28T16:35:58.831Z",
  "source_roots": [
    "data",
    "research",
    "ops/codex-jobs/live",
    "ops/codex-jobs/archive",
    "ops/codex-batches/runs"
  ],
  "reconciliation_policy": {
    "batch_plan_path": "ops/codex-batches/parallel-batch-plan.v1.json",
    "live_job_root": "ops/codex-jobs/live",
    "archive_job_root": "ops/codex-jobs/archive",
    "batch_run_root": "ops/codex-batches/runs",
    "decision_root": "ops/reconciliation/decisions",
    "active_candidate_statuses": [
      "draft",
      "submitted",
      "in_review",
      "needs_revision"
    ],
    "duplicate_source_keys": [
      "doi",
      "pmid",
      "trial_registry_id",
      "url",
      "source_type_name"
    ],
    "duplicate_study_keys": [
      "registry_id",
      "source_set",
      "study_type_name"
    ],
    "promotion_blocking_categories": [
      "duplicate_source",
      "duplicate_study",
      "overlapping_candidate_proposal",
      "source_rights_conflict",
      "incomplete_ledger",
      "parallel_worker_pending_reconciliation"
    ]
  },
  "summary": {
    "source_count": 10,
    "duplicate_source_group_count": 0,
    "study_count": 9,
    "duplicate_study_group_count": 0,
    "candidate_count": 58,
    "active_candidate_count": 41,
    "overlapping_candidate_group_count": 0,
    "source_rights_count": 2,
    "source_rights_conflict_count": 0,
    "agent_run_count": 64,
    "parallel_batch_count": 7,
    "reconciliation_batch_count": 6,
    "parallel_batch_run_count": 19,
    "pending_parallel_worker_count": 0,
    "reconciliation_decision_count": 8,
    "incomplete_ledger_count": 0,
    "open_finding_count": 0,
    "blocking_finding_count": 0,
    "warning_finding_count": 0
  },
  "parallel_batches": [
    {
      "batch_id": "parallel-batch-001-candidate-review",
      "parallel_group": "candidate-review",
      "execution_class": "independent",
      "reconciliation_required": false,
      "job_ids": [
        "self-healing-candidate-review-extraction-debt-dq-bone-adverse-events-20wk-mixed-repair-extraction-fidelity",
        "self-healing-candidate-review-extraction-debt-dq-bone-adverse-events-20wk-mixed-repair-safety-limitations",
        "self-healing-candidate-review-extraction-debt-dq-bone-adverse-events-20wk-mixed-repair-synthesis-boundary",
        "self-healing-candidate-review-extraction-debt-dq-bone-adverse-events-20wk-mixed-repair-taxonomy-mapping"
      ],
      "overlapping_execution_keys": [],
      "status": "no_reconciliation_needed",
      "finding_ids": []
    },
    {
      "batch_id": "parallel-batch-002-extraction-refresh",
      "parallel_group": "extraction-refresh",
      "execution_class": "reconciliation_required",
      "reconciliation_required": true,
      "job_ids": [
        "self-healing-coverage-gap-senolytics-exact-effect-extraction-followup-2",
        "self-healing-coverage-gap-senolytics-registry-surveillance-breadth",
        "self-healing-coverage-gap-senolytics-review-landscape",
        "self-healing-coverage-gap-senolytics-safety-tables-followup-2"
      ],
      "overlapping_execution_keys": [
        "path:data/coverage-assessments/senolytics-coverage-repair-2026-06-21.json",
        "target_record:coverage_assessment/senolytics-coverage-repair-2026-06-21"
      ],
      "status": "reconciliation_open",
      "finding_ids": []
    },
    {
      "batch_id": "parallel-batch-003-extraction-refresh",
      "parallel_group": "extraction-refresh",
      "execution_class": "independent",
      "reconciliation_required": true,
      "job_ids": [
        "self-healing-extraction-debt-dq-ad-risk-cognition-mobility-mixed",
        "self-healing-extraction-debt-dq-bone-bmd-20wk-inconclusive",
        "self-healing-extraction-debt-dq-bone-ctx-20wk-null",
        "self-healing-extraction-debt-dq-bone-headache-20wk-descriptive"
      ],
      "overlapping_execution_keys": [],
      "status": "reconciliation_open",
      "finding_ids": []
    },
    {
      "batch_id": "parallel-batch-004-extraction-refresh",
      "parallel_group": "extraction-refresh",
      "execution_class": "independent",
      "reconciliation_required": true,
      "job_ids": [
        "self-healing-extraction-debt-dq-bone-p16-t3-ctx-2wk-positive",
        "self-healing-extraction-debt-dq-bone-p16-t3-ctx-4wk-inconclusive",
        "self-healing-extraction-debt-dq-bone-p16-t3-p1np-2wk-positive",
        "self-healing-extraction-debt-dq-bone-p16-t3-p1np-4wk-inconclusive"
      ],
      "overlapping_execution_keys": [],
      "status": "reconciliation_open",
      "finding_ids": []
    },
    {
      "batch_id": "parallel-batch-005-extraction-refresh",
      "parallel_group": "extraction-refresh",
      "execution_class": "independent",
      "reconciliation_required": true,
      "job_ids": [
        "self-healing-extraction-debt-dq-bone-p16-t3-radius-bmd-20wk-positive",
        "self-healing-extraction-debt-dq-bone-p1np-20wk-null",
        "self-healing-extraction-debt-dq-bone-p1np-2wk-positive",
        "self-healing-extraction-debt-dq-bone-p1np-4wk-positive"
      ],
      "overlapping_execution_keys": [],
      "status": "reconciliation_open",
      "finding_ids": []
    },
    {
      "batch_id": "parallel-batch-006-extraction-refresh",
      "parallel_group": "extraction-refresh",
      "execution_class": "independent",
      "reconciliation_required": true,
      "job_ids": [
        "self-healing-extraction-debt-dq-bone-sasp-2wk-null",
        "self-healing-extraction-debt-dq-bone-turnover-mixed",
        "self-healing-extraction-debt-dq-dkd-biomarker-positive",
        "self-healing-extraction-debt-dq-ipf-dosing-completion-mixed"
      ],
      "overlapping_execution_keys": [],
      "status": "reconciliation_open",
      "finding_ids": []
    },
    {
      "batch_id": "parallel-batch-007-extraction-refresh",
      "parallel_group": "extraction-refresh",
      "execution_class": "independent",
      "reconciliation_required": true,
      "job_ids": [
        "self-healing-extraction-debt-dq-ipf-tolerability-mixed",
        "self-healing-extraction-debt-dq-old-mouse-survival-positive"
      ],
      "overlapping_execution_keys": [],
      "status": "reconciliation_open",
      "finding_ids": []
    }
  ],
  "duplicate_sources": [],
  "duplicate_studies": [],
  "overlapping_candidate_proposals": [],
  "source_rights_conflicts": [],
  "incomplete_ledgers": [],
  "open_findings": []
}
